L-I,groups of ants are called coloniessome ants are so small a person can barely see themsome ants eat small animals some insects and some plants and more foodsants are soocial insects
L-I,hello i am timmy and i learned about coyotes position in the food web coyotes are the top predators in the pine bush ecosystem and will eat deer rabbits rodents chipmunks carrion and much more coyotes will also eat berries and fruit if they need to but they mostly eat meat
L-I,i have learned that moss detaches from the thing it's on when it's going to start to die i know from my experiment of takeing detached moss and putting it into good soil after a few of days it was no longer detachable
L-I,i think you miss understood this is the mosse´s spores perpuse mosses reproduce using spores not seeds and have no flowers moss gametophytes have stems which may be simple orbranchedand upright or prostrate their leaves are simple usually only a single layer of cells with no internal air spaces often with thicker midribs
L-I,"image kf6 rit albany edu attachments 5b87586745b8a02554df72de 5bb26bbf502a7223616cd316 1 220pxpentatomidae__halyomorpha_halys001 jpg&lt the dusky stink bug my theory is the bug uses its colors to camoflouge itself so it wont be eaten this theory cannot explain why this bug has designs on it's back new information insect called dusky stink bug ________________________________________________________________________________________10 1 18 new information stink bug is herbivore and a stink bug will bite if it feels threatened ________________________________________________________________________________________10 2 18 new information stink bugs stink when killed crushed ""molested"" a stink bug stinks as a defensive act to prevent any threat to their lives the stink also invites its friends to come to its territory ________________________________________________________________________________________10 3 28 new information the dusky stink bug is naturally found ineastern north america like all stink bugs this bug has sharp sholders and a hard shell thats why it is relatively hard to crush them ________________________________________________________________________________________10 4 18 new information stink bugs also hunt beetle larvaeor caterpillars ________________________________________________________________________________________ here is where i get my new info stinkbugsguide net facts htm link stinkbugsguide net facts htm stopbmsb org stinkbugbasics lookalikeinsects link stopbmsb org stinkbugbasics lookalikeinsects wonderopolis org wonder whydostinkbugsstink link wonderopolis org wonder whydostinkbugsstink"
L-I,peroxisomes peroxisomes are tiny single membrane bound structures that contain enzymes which produce hydrogen peroxide as a byproduct these structures are involved in plant processes such as photorespiration plasmodesmata these pores or channels are found between plant cell walls and allow molecules and communication signals to pass between individual plant cells ribosomes consisting of rnaand proteins ribosomes are responsible for protein assembly they can be found either attached to the rough er or free in the cytoplasm vacuole this plant cell organelle provides support for and participates in a variety of cellular functions including storage detoxification protection and growth when a plant cell matures it typically contains one large liquidfilled vacuole
L-I,plants need carbon dioxide sunlight and water for photosynthesis photosynthesis is how the plant makes oxygen and food
L-I,plantshave only three tissue types dermal ground and vascular dermal tissue covers the outer surface of herbaceousplants vascular tissue includes xylem phloem parenchyma and cambium cells two views of thestructureof the root and root meristemby elena delrio
L-I,some trees change color and die during the cold weather in the fall and in winter but some of them like the tall green tree and pine trees now you know why pine trees are christmas trees also it would be a little weird if you hang ornaments on deciduous trees deciduous trees are those trees that chane color in the winter and die
L-I,the following are examples of structures and organelles that can be found in typical plantcells cell plasma membrane this thin semipermeable membrane surrounds the cytoplasm of a cell enclosing its contents cell wall this rigid outer covering of the cell protects the plant cell and gives it shape chloroplast chloroplasts are the sites of photosynthsisin a plant cell they contain chlorophyll a green pigment that absorbs energy from sunlight cytoplasm the gellike substance within the cell membrane is known as cytoplasm it contains water enzymes salts organelles and various organic molecules cytoskeleton this network of fibers throughout the cytoplasm helps the cell maintain its shape and gives support to the cell
L-I,"the information i have learned is all from brainpop new information there are over 12 000 species of ants many species have different behaviors i have also learned the ""exoskeleton"" around the ant protects the ant but it also helps the ant move about my final thing i learned was that male ants are called ""drones"" and their only job is to mate with the queen to create eggs afterwords they die"
L-I,why do trees need sunlight and water trees plants needs sunlight and water because**plants need waterandsunto make their own food energy photosynthesis the food that they make is sugar they make it on leaves plants also needs soil another fact * air can transport pollen and seeds fromplantsso that newplantscan grow image image shutterstock com imagevector diagramshowingprocessphotosynthesisillustration260nw563007307 jpgwe need water for roots some extra information are that leaves also give oxygen so if ther ewere no plants we would not have hair or anything so the only thing that helps us are motly improtantly plants
L-I,new information when a ant is born it is whiteand it gets it color when it gets older
L-I,missing link moss can only grow in a clean enviroment moss can't grow if there is pollution
L-I,a better theory ants do not just find th hills
L-I,my theory a grasshoppers thorax is really big
L-I,my theory grasshoppers are one of the most unic insectson the planet
L-I,new information ants are born with wings and when some ants get older there wings fall of
L-I,new information ants do not find the hills they build them with dirt but i am not sure how they build them i am pretty sure they work together to build it i will have to find that out
L-I,new information ants have three main body parts the head the thorax and the abdomen
L-I,new information ants live in groups called colonies
L-I,new information ants love fruit and eneything sweet
L-I,new information ants work togther to do a ot of things like build ant hills ants bodys are devided into three main parts the head the thorax and the abdomen
L-I,new information every living thing has energy
L-I,new information grasshoppers really have sixlegs
L-I,new information if a ant is feed the right food it will become a queen ants
L-I,new information if baby ants eat the right food they can turn into the queen
L-I,new information is i know that moss has very tiny thin roots i think because when i pick up moss i can't even see the roots of the moss
L-I,new information is that worms in the courtyard only come out when you lift some thing wet or when it rains then when the rain comes the worms come up from out of the dirt and i know i hav seen it
L-I,"new information moss grows and spreads called ""spores "" they're special reproductive cells that grow on moss since the spores are very light the wind blows th spores away creating more moss"
L-I,new information mosses and ferns are eukaryotic which means they have nucleus they also contain cell walls made of cellouse a fibrous and tough material
L-I,new information newly hatched eggs become slaves and only queens can lay eggs
L-I,new information queen bess lay the eggs
L-I,new information the mosquitos can spred a deathly illness though so if you see a moquito sucking out someone's blood kill it
L-I,new information there are over 12 000 kinds of ants males have wings females don't have wings and when the queen dies the colony falls apart
L-I,new information when an ant builds a ant hill they make tunnelsin they ants hill like rooms
L-I,new information when it's cold ants sleep through the winter they can be frozen without harm ants also move their colonies deeper below the frost line ants also can sleep in logs and stumps
L-I,new information ants bodys are divided into 3 main parts head thorax and abdomen
L-I,new information some trees are very slow and takes 20 to30 years some reach to full size 1015 years it's growth depends on what type of tree it is
L-I,putting our knowledge together ants sleep in the winter they dig their colonies deeper below the frost line and can be frozen without harm
L-I,anthills can shelter thousands o ant
L-I,a baby female ant eats special food and becomes a queen
L-I,a mousqutio is a arachnid so is a scopein and a spider
L-I,a small flowerless green plant of the divisionbryophyta which comprises the mosses and liverworts
L-I,a swarm of army ants can kill 100 000 insects spiders and even small animals in a day
L-I,abiotic and biotic are other words for nonliving and living
L-I,ad a midrib is alarge strengthened vein along the midline of a leaf
L-I,adark greencolour with a tint ofyellow like that of moss darkmoss greencolour a pale greyishgreencolor like that of lichen
L-I,ant h hills are non living
L-I,ant hills are made of dirt clay and some times pine nedles
L-I,ant hills are nonliving
L-I,ant hills are nonliving things people
L-I,ant hills can also be built out of sand
L-I,ant might more than one at a time
L-I,anthills are nonliving
L-I,anthony mosquitos also kill the most people yearly out of any animal in the world
L-I,ants are a very light color when they hatch from the egg but they grow darker as they get older
L-I,ants eat fruity stuff like fruit and other stuff
L-I,ants eat worms
L-I,ants has recepters whitch could detect food or danger
L-I,ants have been around sens the cretaceous period
L-I,ants love sweet things such as fruit
L-I,ants make there ant hills out oit of dirtand make a hole
L-I,ants used ant hills for bad weather they alos used it for store food in ant hills
L-I,ants will also eat threr ownkind whe the die
L-I,are all beehives edible
L-I,are all beehives eteble
L-I,baby ants are light colored when they are babys and when they get older they get darker
L-I,beehives ar nonliving
L-I,beehives are nonliving the bees just live in which does not make the beehive living
L-I,bees polinate flowers for other animals and us
L-I,brydie wolves do not live in the pine bush they live in canada and the western us
L-I,bryophyte is a moss
L-I,daddy long legs areopilione not spiders
L-I,did you know that ants have been on earth sens dinasors and survived the ice age
L-I,dont let ants out and with a parant you can do experiments
L-I,flora and i am doing a experiment with moss we put moss that was half way dead in a cup filled with dirt inside the cup there is a plant which was detached from the ground with it's roots and we water it every 3 of 4 days
L-I,grass hopers have 6 legs check your work please thanx
L-I,i already know that queen ants are made by eating a spcific type of foodweet food
L-I,i don't know but lets both do some esearch and we'll figure it out
L-I,i found a video of a tree that grows 40 diffrent stone fruits the the way the man who made the tree was he got a branch from each fruit tree and put them together with plastic wrap and it took 3 years for the tree to grow and it growd all by itself
L-I,i have to say that penguins can't fly ecause there only home is the artic and they have to stay there also because they where built for the artic to
L-I,i just found out that the plants take in co2 and let out oxegen which is what we breath in
L-I,i just found out they give off oxegen into the air which is what we breath in
L-I,i learned that there are different types of air poulltion can effect different people like in the video i saw ittold me that there are air types that are hazordus and can be very harmful
L-I,i learned that there are over 22 000 different types of moss but we mostly see here in ny fire moss and ceratodon purpureus moss
L-I,i now have found ut that they also use co2 to make there sugar to
L-I,i think that they have what they need they have food water and sun
L-I,i told you you have to do a 2 finger click when you do that you have to click the open link to new tab
L-I,iagree wit you spores are microscopic
L-I,in science we planted beans on 11 31 now it is 12 3 and there was no progress then i looked up how long will it take so my theory is that on 12 7 or 12 10 it will show some progress
L-I,inoticed that after the leaves change color the enregy is no longer getting produced so that could be a reason they fall off
L-I,it's a seedless plant it has spores
L-I,know i know why mosquito bites itch so much mosquitos are so annoying the itchyness can last for so long when the real bit part is only a few seconds mosquitos
L-I,looked like the start of a bee hive
L-I,mosquito bites can be so powerfull that they can crush blood vesls
L-I,mosswith nearly10 000 species liverworts phylum marchantiophyta account for approximately6 000 species and hornwort phylum anthocerotophyta species number about 200 by brenna stephens
L-I,moss can grow anywhere even on trees and rocks
L-I,moss dosent just grow on trees it wiil grow on most things if it has moisture it will grow
L-I,moss forms by the little seeds that are let go by the moss
L-I,moss grows in cool and wet conditions and the moss groes back every spring after winter
L-I,moss spores spread onto certain things and they need sun and water to help them grow my theory my theory my theory my theory putting our knowledge together
L-I,o think that peguins need feathers to keep themselves warm
L-I,ok shreyas thanks for the advice
L-I,ok so ehhhhhhhh i love the advice thanks i'll reasearch more i promise
L-I,okay so ehhhhh
L-I,rhizoids attach the moss on whatever it's growing on
L-I,rivers are just lots of streams joined together
L-I,small animals and insects live in moss
L-I,snowflakes form depend on the tempreture of the air warmer simple formcolder complex form
L-I,so far what i know is that rain after it gets dehydrated it creates mud and later after thats done it creates soil
L-I,soil and paper towel have some progress it's 12 7 and we hve some progress the others have nothing so far i hope next week on 12 10 there will be more progress
L-I,some ants build there ant hills by weaving leaves togther
L-I,spores carried by wind spread the moss
L-I,spores carried by wind they also need a little moisture
L-I,squirels are fat
L-I,sqwirls and chipmunks live in trees
L-I,thats not how you spell grasshoppers or info check this bill thanks
L-I,the animals and insects that live in the courtyard are mainly birds bees grasshoppers ants and antholes and possibly some arachnids
L-I,the answer is the sun pushes the air on our body and they call it wind
L-I,the bit ecan be deadly pisonis
L-I,the mosquito is just trying to get food
L-I,the moss will eventually all die at least therse a 50%50 chance that it will
L-I,the need the sun for giving them nutriens
L-I,the queen ant lays all the eggs
L-I,the raise of the sun are so powerful that even some of jupiter the raise feeds all of the producers and animals
L-I,the trees get nutrious y the water feeding the roots and the sun
L-I,theere is millions of ants thats how
L-I,there are a billon ants in a ant hill
L-I,there are alot more then a thousand ant holes on earth more like billions of ant hills
L-I,there are two types of fresh water hard and soft hard water has lots of metals soft water has no minerals
L-I,there can be thousand of ants in one ant hill with ony one queen
L-I,there is a grass called perennial fountain grasspennisetum alopecuroides
L-I,there is an ornamental grass called feather reed grass calamagrostis acutiflora and it is from 3 to 5 feet tall and it has a lot of flowers
L-I,there may be food in the tree
L-I,there may be thousands of ant holes
L-I,they have sounds that they make
L-I,they lay thousends of eggs a day
L-I,they make it so bees can live in them
L-I,they mix blobs of silk with water to make webs
L-I,they need moisture and shade to grow
L-I,titariomyrma gigantuem size 6 cmmonomarium pharaonis size 2 mm🐜🐜🐜🐜🐜🐜🐜🐜🐜🐜🐜🐜🐜🐜
L-I,today is the 10th of dec there is a little progress the beans are swealing like crazy i'm going to continue my work and keep checking and write more on those days
L-I,when i watched a brain pop video i learned that seedless plants have spores spores are kind of like the seeds for seedless plant exept they´re microscphic
L-I,yes exactly thank you its also made from sand and pine nedles
L-I,you also need co2 for photosynthesis
L-I,you should make a biger quashtion because you could just serch that up and mabey you can wach that brain pop video
L-I,you should make your question longer because bees live 122 to 152 days or early bumblebees can live 28 days
L-I,ω soil is a wonder and i've never heard of white soil and anyway soil is used for many things like plants chipmuncks and people
L-IS,i need to understand
L-IS,my theory
L-IS,this theory cannot explain why animals
L-IS,i agree with you too
L-IS,i dont know
L-IS,so dark
L-IS,testing this
L-Q,i need to understand are ant hills living or noliving
L-Q,i need to understand are ant hills alive
L-Q,i need to understand how ants build ant hills do they help other ants build ant hills or do they make them all alone
L-Q,i need to understand how did are ecosystem start
L-Q,i need to understand how do ants build ant hills
L-Q,i need to understand how we feel air but we can't see it
L-Q,i need to understand if a femail ant can become a queen be from eating the right food then what happes if a mail eats the right food
L-Q,i need to understand if the sun is so far away how can we still feel the hotness of the sun
L-Q,i need to understand that what is the thing that makes the air push on our body
L-Q,i need to understand the evidence of how moss is fuzzy my theory
L-Q,i need to understand what is the yellow tanish stuff that kind of looks like roots or ginger so i smelled it and it smelled like fresh grass and kind of like garlic
L-Q,i need to understand why we are not able to see air we feel it why can't we see it
L-Q,"i need to understand ""why do some catepillars have fur kind of suff "" image kf6 rit albany edu manual_assets kf4images iconnoteunreadothr gif""my wondering by shreyas srivastav"" link contribution 5bb64dcb502a7223616d129e by shreyas srivastav"
L-Q,are ornamental grasses found all over the world 😐
L-Q,did you know that there is a queen ant
L-Q,do ants have love ♡
L-Q,do ants sleep do they go into hibernation
L-Q,do plants eat sunlight
L-Q,do venomous and poisonous animals eat each other if they do do they still live
L-Q,does weather do anything to the ecosyestems
L-Q,dose anyone have any good experaments ☺
L-Q,how are animals so social and work together what are their strategies
L-Q,how deos moss plants eat thier food
L-Q,how did you get this
L-Q,how do animals get into the court yard
L-Q,how do ants build ant hills or do other anamils build
L-Q,how do spiders climd walls
L-Q,how do spiders spin weds
L-Q,how do the rocks get into our courtyard
L-Q,how do tree's grow why does it need water and sunlight how many days does it take for a tree to grow does it matter if its a different type of tree
L-Q,how does air poulition effect people
L-Q,how does sunlight help living things
L-Q,how does the white soil interact with plants
L-Q,how dose the sun help and what dose it do to hel our eco sistme
L-Q,how long can a queen bee live
L-Q,how long can bees live in there lifetime
L-Q,how long do ants live
L-Q,how was white soil created
L-Q,i definitey agree with this but are they strong enough too crush 10 or more
L-Q,i have a new theroy about how ants build their houses i think they could possibaly push sand mud dirt to were they want the anthills
L-Q,i wonder how they get the blood out
L-Q,i wonder if a big flower like a sunflower can grow in a small spacefrom sienna my theory is no it cant
L-Q,i'm learning about the diffrence between air does the air in the adirondack mountains have more or less carbon dixoide then the air in nyc
L-Q,i'm wondering if some stomich acids are emzins yes i know i spelled that wrong
L-Q,if animals don't change their fur for the season then what will happen
L-Q,if the animals in the ges courtyard had a harsh storm that flooded the area how would the survive
L-Q,if you put carbon dioxid in a cup with a plant you know it will go back to blue but if you dont put a plant in will it still go back to blue
L-Q,im lerning aboute the pine barrens in guilderland and how dose the prescribed burns help the pine barrens
L-Q,im wondering how frogs\todes live in this environment pluse how do thise tad poles live here and what wants them to live here mabey they think this is a miny lake
L-Q,in the court yard the apple tree is tilted did it gorw like that
L-Q,in the courtyard why is the apple tree tilted or did grow tilted
L-Q,is bateria an animal
L-Q,my first question was why are some plants bad to touch but my question now is if some plants are good to touch and eat then why are some plants poisionous
L-Q,so i am wondering how photosythesis works and really what it is hopefully i can get back to you guys on that
L-Q,wacht this youtube com watch v=j0dt_te0xz4
L-Q,was metal once living
L-Q,were do the ants get woter from uder grawnd
L-Q,what animals live in the court yard
L-Q,what are ornamental grasses
L-Q,what can we do to be able to see air
L-Q,what can we do to see the air
L-Q,what can we infer the stuff that pushes the air on our faces on windy days
L-Q,what causes the poison ivy to interact with humans and create a rash
L-Q,what evidence do we have how air is invisboll
L-Q,what evidence dose the worm home so sandy
L-Q,what evidence is there that there are dangerous animals out in the wild near our area
L-Q,what type of trees have small red berries on it
L-Q,when i was out in the courtyard i saw a lot of moss my question is how it got there i need to understand
L-Q,when i was walking in the courtyard i was thinking about my theory what is the sciene behind the evolution of air
L-Q,where is the link
L-Q,why are worms and ants in dirt worms can move only in or near dirt and ants can come out of their ant hil
L-Q,why are you talking about ants on the photosynthesis page
L-Q,why can't peguins fly
L-Q,why did the weather get cold why did the wather sudenly get hot then get cold
L-Q,why do animals eat
L-Q,why do animals hide in the bushes in the wintor
L-Q,why do the anmolls hide in the bushes
L-Q,why do the apples fall from the trees and then rot
L-Q,why do the insects get into the bark into the tree
L-Q,why do things rotthings rot because when you peel a orange the air efects the orange
L-Q,why do you have to do a controlled fire when you can just cut the plants down
L-Q,why does moss provide a good home for insects
L-Q,i'm talking about the stem not the flower like a rose my theory is that it stings the predator trying to eat it but i think it's impossible i need to understand why does it have thorns do they sting do they do nothng at all are they worthless
L-Q,i need to understand how worms move in the soil my theory is that they move similarly to a snake they kind of move like slinking around in the soil
L-Q,i need to understand if animals live in our school cuortyard and i think animals do live in the court yard because there are alot of holes in one of the trees this theory cannot explain if animals live in the courtyard
L-Q,i need to understand if the grass hopper is living in the courtyard because there is some nutrients from the trees or if there are hidden food supplies there this theory cannot explain if there is somthing that is in the court yard that makes the grasshopper want to live in te courtyard
L-Q,i need to understand what would happen if you cut off a root from a tree will it die or will it still live or will the leaves fall off the tree my theory i think the roots carrie nutrients
L-Q,i need to understand why moss has different colors and what it means to have all these different colors my theory is maybe it means it is poisonousor it means that its a different type of moss
L-Q,i need to understand why snakes can slither wouldn't its tail be more efficent in the water i wounder if a snake addapted when it started living on land new information is that how can snakes eat somthing bigger than them wouldn't it take weeks for something that size to be diegested so i'm woundering if snakes go into hiding and have a small hibernation my theory is that mabey after alarge meal its normal to sleep to help diegest foods and liquids
L-Q,my theory my theory how do bee'shelp us human's how do bees help other living things how is pollination helpful what is pollination
L-Q,my theory is it wont grow and it will just fall down i need to understand if there is still sun will it grow
L-Q,my theory is mabye if they pertend to be deid on the berrys al the stink bugs will think he died and if they think it is deid no one will go on the berry and it can just keep sucking it i need to understand how they get so smart if that is the case
