L-I,a rainbows are made by raindrops that act like a prism that make the rainbow
L-I,if you look at a green apple for a long time the green cone gets tired but the red and blue are not tired and together red and blue make purple and purple is the opposite color of green
L-I,most things that glow have some fluorescent paint on them this paint absorbs light and then glows until it has no more light absorbed in it
L-I,a shadow is made when darkness made when light shines on a opaque object
L-I,a liner eclipse is when the earth is between the sun and the moon
L-I,a solar eclipse is when the moon is between the sun and the earth
L-I,a shadow is made when a light source hits an object
L-I,a lunar eclipse is when the sun foe between the moon and casts a shadow
L-I,a solar eclipse is when the sun goes in front of the moon
L-I,i need to understand why you can get two different kinds of shadows one that is larger than you and one that is smaller than you my theory of what happens is that it appends on the time of day
L-I,what helps things that glow are fluorescence pink and other colors
L-I,if your body wants to see a red rose the red is bounced into your eyes and the other colors are absorbs
L-I,if your body wants to see a yellow green and red is bounced into you eyes and the blue is absorbed
L-I,solar panels takes in light and makes it in to energy
L-I,my understanding shadows starts at the shadow view if a light sours hits a optic nontransparent object which creates a shadow such as a person is standing behind a light sours and a shadow papers behind them
L-I,rain can can be used as prisms thats why theres a rainbow after it rains
L-I,a solar panel absorbs light and uses it as energy
L-I,fireflies produce light from their abdominals because of a chemical reaction caused by lucifer and lucifer this is called photoluminescence
L-I,this is how a glow stick works when you snap a glow stick it makes a little hole and to chemicals collide and then they glow this is called chemiluminescence
L-I,a shadow is made by standing in front of a light source and then the place you block up is where the shadow is made
L-I,a solar eclipse is when the moon passes in between the sun and the earth causing a big shadow
L-I,i thought glow in the dark could only happen with one thine but then i read yasmin note and saw that it happens with three things heat friction and electricity
L-I,in the shadows view i learned the closer the sun is to you the stronger it is
L-I,also i learned that your body blocked the sun and that creates a shadow the sun goes through the ground and makes a shadow for a root
L-I,a rainbow in rain is made because its so damp outside
L-I,we see a red rose because the primary colors go to the rose and green and blue get absorbed and red bounces off
L-I,we see a yellow rose because all the secondary colors go at the rose the magenta and cyan gets absorbed but yellow bounces off
L-I,a shadow is the darkness left behind when a light sours shines on a nontransparent object
L-I,a solar eclipse is when the moon blocks the sun light from coming to the earth
L-I,a lunar clips is when the sun blocks the moons light from going to earth
L-I,you can make a rainbow with a prism by outing light thought a prism of rain rain is what make the rainbow in the sky
L-I,solar panels are panels that use light to make electricity
L-I,all we see is light without light we can not see
L-I,we can see a yellow rose because red blue and green are going to the flower red and green bounce into your eyes but blue absorbs
L-I,you can see a red rose because red bounces of and goes into your eyes blue and green get absorbed
L-I,when you see a red flower the red light bounces off the flower in to our eyes and the green blue gets absorbed
L-I,when you shine a light through a glass prism it ell make a rainbow on the surface it needs to be white light of the colors light wail be to strong and wont split up into the rainbow
L-I,this is how absorbing and reflecting works the colors that make the object will be reflected and the leftover color will be wasted not used
L-I,a shadow is mad by an object in front of a light stream the light cant go around and then no light git be hind the objects and its dark
L-I,a solar eclipse is an eclipse of the sun it occurs when the moon is located between the sun and the earth the moon blocks the sunlight coming to the earth
L-I,my theory is that light travels in waves i leaned this by doing an ensnarement the end resale was a wave pattern like doping to pebbles in a pond and the reason is like light
L-I,most glowing things are painted with a layer of fluorescent paint this paint absorbs light and when it is dark the absorbed light would unleash the light that it saved until its empty and has no more light
L-I,a lunar eclipse is the opiate of a solar eclipse a lunar eclipse is when the earth goes in front of the moon the earth is also opaque but the shadow this time is bigger
L-I,if light hits a red rose red gets reflected and blue and green get absorbed thats why we see red
L-I,but with a yellow rose green and red get reflected and blue gets absorbed because red and green make yellow
L-I,a lunar eclipse is when the moon over laps the sun and blackens out the sky so no one ca see the sun and the sun and the moon turn black
L-I,what is absorbing my understanding is that when white light hits a red object all the colors that make white red green and blue blue and green are reflected and red is absorbed
L-I,what is reflecting my understanding is like before we have a red dress when white light hits the red dress blue and green are reflected and red is absorbed why i think there reflected is because its not the same color
L-I,this is how we can see a red rose white light hits the rose red is reflected and blue and green are absorbed and the rose papers upside down and back wards but your brain turns it to the right way
L-I,new information a lunar eclipse is when the earth is between the sun and the moon since the earth is in front of the moon it castes a shadow over the moon making it in total darkness
L-I,a solar eclipse is when the moon casts a show over the earth and its just like a lunar eclipse precept what i just told you
L-I,the way we see a red rose is that white light contains the primary coleus of light red blue and green what happens is that the red light hitting a red rose the red light bounces off and into our eyes and the other colors get absorbed
L-I,with a yellow ors its pretty much the same thing but 2 colors don't get absorbed they mix and bounce off as one ray
L-I,the northern lights are cosed by partials from the sun the particles are so small you couldn't see them how they acute is when the particles hit highest thing of the earths atmosphere they electrify the air making it glow
L-I,convex mirrors are used in stores they let you see around corners and stuff ltd shaped like a ball with the top cut off the way it lets you see around corners is it does everything but catch light so it bounces off as an angle
L-I,all we see is light the way i can prove it is that the same color light bounces off things that are supposed to be that color then the color bounces into your eye three primary colors are in white light so if you mix those you'll get any color
L-I,i just learned that a lunar eclipse occurs when the earth is between the sun and the moon the earth is in front of the moon and behind the sun which makes a huge shadow over the moon
L-I,this is how rainbows are made with rain the sky is still moist and there are drops in the air which can be used like prisms so if the left over raindrops can be used like prisms then the light can shine through it to make a rainbow
L-I,i think light travels in a straight line because the shadows prove that they travel straight or else the shadows would be wobbly
L-I,if you look at a red rose in magenta light the magenta light red and blue hits the red surface the color red is reflected but the color blue is absorbed then the rose appears red
L-I,my understanding about a lunar eclipse is that when the earth is between the sun and the moon the sun casts a shadow over the moon called a lunar eclipse
L-I,my theory's that light travels in a wave line because if you drive behind a bus you'll see heat that looks wave
L-I,shadows a shadow is an inexact reflection of your body that shows on a very sunny day when you are outside you see your shadow when you happen to be outside and you look down at the ground also your shadow touches you wherever you touch the ground
L-I,we see a red rose when there is a flashlight or another light source that will shine on the rose and absorb the green and blue light and reflect the red light into our eyes
L-I,and how we see a yellow rose is that it is the same but the red and green light are reflected and blue is absorbed
L-I,how do you make a rainbow with rain the sky is still wet with raindrops and the sunlight shines through the drops and a rainbow forms in the sky make a rainbow with a prism exactly the same way
L-I,the northern lights are also called the aurora borealis and they are lights in the sky that are mixtures of colors that are seen only in the northern parts of the world and that is why they are called the northern lights
L-I,why are northern lights different colors each gas in earths atmosphere glows with its own color when it becomes charged with electricity oxygen gives off an eerie green glow nitrogen glows red and neon gas turns pink
L-I,i also learned that a solar eclipse happens when the moon blocks the sun which makes a large shadow over the earth that is why when your outside and the sun dispersals its just a large shadow
L-I,i also learned that a lunar eclipse is caused when the earth is between the sun and the moon
L-I,also if your looking at a yellow flower the blue light would be absorbed allowing the two other colors to both making yellow would bounce of into your two sensitive cone to those colors
L-I,the northern lights are caused by the sun bombarding the earth with tiny partials of electricity when these partials hit the highest part of the hates atmosphere it electrolysis the air and makes it glow
L-I,to make a rainbow with rain it in voles moisture in the air and since there is moisture in the air the moistness acts like a prism
L-I,a lunar eclipse is when the earth is right in between the sun and the moon winch casts a shadow over the moon making the moon total darkness
L-I,solar panels are used for sucking up sunlight and using the sunlight for something such as a solar powered windmill that works by the sunlight getting sucked into a solar panel and the light moves the windmill
L-I,a red rose looks red because the red light in the white light reflects of the rose and in to your eyes the blue and green light gets absorbed
L-I,a yellow flower looks yellow because the red and the green light in the white light are reflexed in to you eyes and the blue is absorbed
L-I,a lunar eclipse is when the earth is between the sun and the moon and it casts a shadow over the moon
L-I,inside luminous objects or animals some form of energy changes into light energy this energy usually changes into chemical electrical thermal and nuclear energy the process of giving off light is called incandescence
L-I,you have three eye cones in your eyes one is sensitive to red one is sensitive to blue and one is sensitive to green so when you see something blue the blue eye cone starts getting sensitive so you can see the color
L-I,when we look at a red rose the red eye cone color bounces off into our eye and the other two colors absorb so you see the color of the rose
L-I,my understanding of light the colors of light light is made up of many many different colors you cannot see those colors because those colors mixed together to get white light white light is transparent so you cant see it
L-I,when it rains the raindrops split the light so you can see 7 discolored orange yellow green blue indigo and violet that make a rainbow
L-I,that is why when you look at a yellow thing the red and green light bounce of it but blue gets absorbs mixes and comes to your eye as yellow
L-I,there are also things called solar panels they are made to catch light the light that they catch is used to make electricity solar panels probably have a lot of tubes connected
L-I,a shadow is the darkness on the other side of an opaque object whits is nontransparent when a light shines on an opaque object the light cant get around it so there is only darkness whits is a shadow
L-I,a lunate eclipse is when the art goes between the moon and the sun the sun hits the eart and the eart casts a shadow on the moon winch give the moon total darkness
L-I,a solar eclipse is when the moon is in the middle and blocks the light from hitting the earth making that side dark
L-I,people make shadows by just standing in the light because light travels in a titrate line or waveland it hits a portion or thing and the blocks the light so it cant reach the ground and thee for makes an outline of that object
L-I,shadow my theory is that all the light gets around but it doesn't get past your body so it is dark and the shape of your body
L-I,a solar eclipse it happens when the moon is located between the sun and the earth and the moon blocks the sunlight
L-I,solar energy solar panels are dark so they attract heat and the sun is turned into thermal energy in the panels there are little tubes and the water gets warmer the warm water is pumped into a storage tank and it heats the house
L-I,the northern lights are red pink ghostly greens the northern lights happen when the sun bombards earth with particles that are electric when they hit the highest part of the earths atmosphere they electrify the air and it glows
L-I,a lunar eclipse is when the earth is between the moon and the sun in which the sun shines on earth and makes a shadow on the moon which makes the moon in total darkness
L-I,if a white light is shined on a red flower the green and blue is absorbed and the red is reflected that is how we see a red flower
L-I,there are two parts of a shadow a umbra dark part which is in the middle and penumbra light part is on the outside part
L-I,lasers are a very very strong source of light they are so hot that they can cut through metal bars with ease diamond sellers cut simmonds which is one of the hardest substances on earth
L-I,transparent means full se through so nontransparent means opaque non see through
L-I,aura borealis commonly none as the northern lights are a form of colored light is usual found in the north pole but it can go south like to france or italy the natives feared them because they thought they were evil things
L-I,photoluminescence is when an animal makes it one light fact over 70 of the worlds deep sea fish are photoluminescence fireflies are also photoluminescence
L-I,photoluminescence is when creatures in small dark places can make them selfs viable for example fire flies have photoluminescence and their is this kind of fish that has a little light on its head
L-I,those are the colors of your eye cones what i mean by your eye cones is you have eye cones is that you have cones in your eyes that are shaped like ice cream cones by mixing them you get the secondary colors
L-I,the secondary colors of light are made by mixing the primary colors of light here are the secondary colors of light yellow magenta and cyan here is how their made
L-I,the northern lights are branches of colored light in the sky you can only see them in the north pole but some times you can see them in muskox in the winter
L-I,a transparent object is something you can see though like stephanie light can go right though it
L-I,a translucent object is some thing that you can kind of see though like paper paper is sort of dark sort of light
L-I,when you have two light sources facing on one thing and there turned on you see two shadows and the same thing happens when you have three light sources are there but three shadows appear
L-I,if you add light to a prism it should change the white light into the colors of the rainbow red orange yellow green blue violet and indigo
L-I,my understanding of natural and artificial light is that living things make there own light like fireflies squids bacteria and fungi 70 present of the worlds deep sea fish make their own light
L-I,lasers can burn through the hardest substance like diamonds the hardest things on earth laser can burn thousands of holes in 1 day
L-I,the law of reflection is that if you shine light at a 90 degree angle it will be reflected as a 90 degree angle the light ray that egos to the flat mirror is called the incident ray and the ray that bounces off is called reflected ray
L-I,its used in things like flashlights if we didn't use concave mirrors in flashlights it would be like a candle
L-I,convex lens with light rays will concentrate light making a focus point that is the most concentrated and after that it starts to get less concentrated
L-I,i also learned that light can not go through an opaque object because it isn't transparent
L-I,another one of the things i learned was that in ancient times people used sundials to tell the time they could tell that the higher the sun was in the sky the shorter the shadow
L-I,when light hits a double convex lens it travels together and hits and the light is concentrated at the focal point
L-I,lasers are very bright and they can burn through anything in the world it can burn through steel and chrome and cloth and iron and metal and everything
L-I,when white light goes through a prism it will make a rainbow all the colors that come out of the prism will be rainbow colors
L-I,chemiluminescence turns chemical energy into light i used to have glowing stars and a moon on the top of my closet so that is an example of chemiluminescence
L-I,making a rainbow with rain is when its raining lightly and the sun is out an example is when you turn on a sprinkler and the sun is shining
L-I,when light hits a flat mirror the angle of incidence equals the angle of reflection when an incident ray hits a 40 degree angle it will come out a 40 degree angle
L-I,a translucent object is not see through that means that you cant look through it but a little light can come through a translucent object can be a pace of paper and an mica computer
L-I,a concave mirror has a sort of cave shape we have mirrors that are flat the mirror that i am talking about is that mirror but pushed in this mirror looks like a bowl when you look into it you see a long shape of yourself
L-I,a convex mirror is the very opposite this mirror is pushed out this mirror looks like a belly as we gr 4 call it a belly mirror when you look into one of these mirrors you see yourself up side down
L-I,concave lens heal near sided people see far sided the light rays goad through the eyes and connect at the back of the head
L-I,lasers are very bright and very strong they can go through anything if you put a red balloon inside a a white balloon and shine a laxer on it the balloon will pop
L-I,to make white light is to shine blue light red light and green light shine all of the colors in the same spot then you will see white light here is a picture to make it more simple
L-I,light can be diffused when light is shone and hits a bumpy mirror and reflects and the light spreads out like a concave lens whits is called diffused reflection
L-I,to make a rainbow withs prism is simple just get a prism and go outside then hold the prism in the air and you'll see a rainbow but sometimes you can not see all the colors
L-I,co lours of light you can make white light by mixing red green and blue primary colors of light light together
L-I,the secondary colors of paint are orange green and violet and they are the colors that the primary colors make when they mix each other
L-I,there are three rinds of eye cones in your eyes they are red green and blue they are sensitive to objects that are either yellow red green blue cyan or magenta
L-I,the gilt rays from a convex lens go inwards into a point that point is the meeting place of the light
L-I,your eyes can adjust to darkness after a few minutes in pitch blackness in a movie theater the movie has light on the screen but it isn't very bright but at least you can see the outlines of the people that you are sitting between
L-I,the angle incidents equals the angle of reflection
L-I,a defuse reflection happens when light hits a bumpy mirror
L-I,you have three eye cones in your eyes one is red and one is green and one is blue they are all sensitive to there own colors
L-I,when light hit a concave mirror the light rays go everywhere but when light rays hit a convex mirror they act normally
L-I,you have three eye cones a blue cone a red cone and a green cone the red cone is sensitive to red light the green cone is sensitive to the green light and the blue cone is sensitive to blue light
L-I,we have 3 different eye cones the 3 eye cones are 3 different colors those colors are red green and blue
L-I,a concave mirror looks like a bowl when light hits a concave mirror it bounces of like in the picture below
L-I,there is some thing called the law of reflection the law of reflection on a flat mirror is when the light bounces of the mirror at the same angle it came on to the mirror
L-I,a diffused reflection happens on a bumpy mirror its when all the light goes in lots of directions
L-I,objects that give off their own light are called luminous objects light sources don't have to be natural to be luminous the sun is luminous as well
L-I,cones are things that respond to colored light there are three kinds of light that cones respond to red blue and green
L-I,light is the colors of the rainbow compressed to make white light a prism splits up light into separate colorsred orange yellow green blue indigo violet
L-I,there are different names for the colors of light those names are the primary colors of light and the secondary colors of light there not just named orally the primary colors are the first colors that make up the secondary colors
L-I,the primary colors are red blue and green the same colors as your eye cones
L-I,a convex mirror is shaped like a belly and a concave mirror is shaped like a cave
L-I,a concave mirror concentrates the light and a convex mirror does the opposite
L-I,a convex mirror since it spreads the light out lets you see more of the stuff behind you a concave mirror since it concentrates light lets you see close up concave mirrors are used by doctors to see up close
L-I,you can add another lens to one of those lenses also a double concave lens would spread out the light and a double convex would concentrate the light
L-I,there are two kinds of light natural and artificial natural light is light from a natural light source and artificial light is something that is made from a artificial light source like light bulbs
L-I,the second thing is fluorescence that is made with friction like when two stones rub together they make fire whits is heat and light that is fluorescence
L-I,news flash if you put a red balloon inside a white balloon and shine a laser at it the laser will pop the red balloon but the white balloon will be unharmed
L-I,and umbra is made when you shine a light source over an object that is bigger than the light source that makes a big shadow that is pretty darker
L-I,a penumbra is when you shine a light source on something that is smaller than the light source that makes a little umbra and a penumbra which is lighter
L-I,eye cones are things that are in your eyes and they see every thing is upside down the image goes threw the eye cone and to the brain and the brain turns it rightsize
L-I,fl you want to make a rainbow you put a prism down and you shine a flashlight at it all the colors will come out the other side
L-I,an umbra is a dark shadow and a penumbra is a light shadow for instance if a light is really dim you will have a penumbra if the light is sting its an umbra
L-I,shadows on the earth are not completely black but the shadows on the moon they are
L-I,the rainbow is made up of colored light the colors of the rainbow are red orange yellow green blue indigo and violet
L-I,there are three eye cones in our eyes and the colors are red green and blue
L-I,a concave object is is pushed back and if you look into a concave mirror you see yourself upside and
L-I,a convex object is pushed out and if you look into a convex mirror you see yourself right side up but you are very large
L-I,when colored light is shined at a opaque object the shadow is black like a normal shadow but when you shine two colored lights there are two shadow and the colors are the colors of the light
L-I,sundials are a form of telling time you can tell the time by the position of the shadow
L-I,shadows also are used to tell directions like north and south you also look at the shadow and that will tell you the direction you are walking in
L-I,a concave mirror is a mirror that goes in and when light is shewn on it the light gets focused
L-I,a convex mirror is a mirror that goes out and when you shine light on it the light bounces off straight looking
L-I,all of the secondary colors mixed together equals white light
L-I,a transparent object is clear and lets 100 light pass through
L-I,a translucent object is clear swell but only lets 50 go through
L-I,an opaque object lets 0 through
L-I,the law of reflection on a flat mirror is the angle of incidence equals the angle of reflection
L-I,the secondary colors are yellow cyan and magenta yellow indigo and purple
L-I,red and blue make magenta
L-I,blue and green make cyan and
L-I,green and red make yellow
L-I,all three primary colors make white
