L-I,a better theory is like how an ants or whatever are working or somthing couse you can wach videos
L-I,my theory do you know energy carries all the time right now energy is being carried from a plant to little animal to big animal back to little animal to soil and it repeats agian and again
L-I,my theory i think worker ants do most of the work the worker ants would be building the ant hill i agree that the ant hills would be made out of dirt too
L-I,my theory if ants build ant houses and they carrie the grains of sand won't they fall of
L-I,my theory if you need any ideas dont water the ants ants could die if waters hits ants build just a few ant hills because thousands of ants live in one ant hill
L-I,my theory is i think if you wanna see if it is a living it has to grow somthing and need water to live new information a non living thing does not need water to survive
L-I,my theory is if a venomous or poisonous animal eats another venomous or poisonous animal some will survive and some will maybe die some animals eat venomous or poisonous animal as a food sourse but maybe another animal can't survive it
L-I,my theory is if you crush a seed and give it water soil and sun it will grow
L-I,my theory is it flips over
L-I,my theory is many apples rot because the weather is changing
L-I,my theory is maybe that the male might become king of the ants
L-I,my theory is over time i think that the stem of the apple gets weaker and weaker and sometimes the wind might blow the apple off the tree and probably some animals nock them off too
L-I,my theory is that a bird or animal flys over and drops it into the courtyard and then lays eggs that make more spider which make more and more and more until they go exsticked or the eco system dies
L-I,my theory is that air works to clean up are ecostyem by blowing dead leaves away or to barry it
L-I,"my theory is that an anthill is prepared by worker ants that are strong like not ants that are just born a better theory is that the queen ant could get a part of a different colony who the queen says in ant language could say ""build me an anthill """
L-I,my theory is that animanles clime under ground to the court yard and eat bugs and frogs other animales to how do all those other animanles
L-I,my theory is that birds carry them over
L-I,my theory is that i usually see moss on the dark areas of trees so i am thinking it forms on dark areas i also think it forms when its dewy and wet
L-I,my theory is that if a predetor is close it will turn over to blend in
L-I,my theory is that if moss dies out then it will create a problem wave in the ecosydom many animals will die and plants will to because it provides water on those hot days when there is no water
L-I,my theory is that it will still live but it cant do thing as fast it will walk way slower and it may die because it cant get to food on time
L-I,my theory is that jaguars don't really eat chimpanzees and that people from africa don't kill and eat jaguars but i think that chimpanzees might eat ants good work overall
L-I,my theory is that mabye 2 grass hoppers went arcross the top of the building and had a lot of kids grass hoppers and thats how this theory cannot explain how the grass hoppers made it across
L-I,my theory is that maybe plantsmake food the roots also need air so they can get nutrients and plants need air they use the carbon dioxide in the air for water because there is 1% of water in air it is called photosynthesis some info from google
L-I,new information all ants have different jobs as they grow they get darker ants go faster since they have tiny legs there can be a thousands of ants in a anthill if a ant get feed the right things they can be a queen
L-I,new information almost every ecosystem needs soil for their environment soil is a massive help towards growing plants and being homes towards many insects without soil plants wouldn't grow and the food web would go wack without all the producers plants
L-I,new information almost every ecosystem needs water to grow its enviornment and its whole species every animal needs water plants need it in order to grow too without plants in the food chain it would go wack making a species over populated and then go extinct
L-I,new information i learned is that abiotic means decomposition by a chemical process and that biotic means decomposition of living orgonisms
L-I,new information peat is formed by decaying moss and plants this is important because peat is a fuel it can be used for fertilizer burn for fuel and eventually it becomes coal
L-I,new information the sun provides humankind with light and heat to create new earth habitate it also provides plants to grow to help the food chain sunlight also helps with weather which weather helps ecosystems too sunlight can cause droughts when there is less rain and intense rain
L-I,new information you can tell how old a tree is if you cut it open a bit you see circles 1 circle for every year
L-I,new information when ants die the other ants leave it alone but after two days they carry it to the ant graveyard they do this because after two days it starts to smell which gives signals to the ants that it is dead
L-I,blockquote i learned that the food chain is what connects animals my theory is that the food chain is in regions because pandas are only in asia so something in antarica can't eat it a better theory i have is that somehing in both places can connect them mabey something that live in one place gets eaten by something tat lives there and in another place and that animal gets eaten by anther animal blockquote
L-I,a plant can grow without real sunlight but if you dont have real sunlight it has to grow withartificial sunlight lamp light night light but a plant can not grow without sunlight
L-I,a species is a group of organisms that are so alike they classify as a group to be a type of species the organisms have to be able to reproduce for example a mule is not a species because it is not able to reproduce
L-I,air+water+sunlight=wind water makes clouds and if you add too much wind you'll make a thunderstorm or atornado
L-I,all moss needs to havespores to live causethat is how water and air gets into the mossor the plant
L-I,all plants usesunlightto make food sugars in a process called photosynthesis
L-I,another reason why living things need energy is because if you don´t eat you can starve and cannot live
L-I,ants are super strong so they dig the hole quiqly even after it gets destroyed
L-I,apples fall off the trees in winter because they get weak
L-I,atoms are small particles building blocks that are everywhere they are made up of a central dense nucleus which is surrounded by one or some more lightweight negativity charged particles that are called electrons
L-I,carbon is everything without carbon there would be no universe
L-I,decomposersbreak down the remains of dead plants and animals and in doing so releasecarbon dioxidethrough respiration
L-I,energy can come from the sun and fossil fules and the suns energy is the main source of life like the plants convert it into food for them and then an anamail comes along and eats the plant and absobs the energy
L-I,first apple trees need sun light to grow and the rain then it keeps growing and growing untill it becomes a big apple tree with tasty apples on it
L-I,flamingos are born gray but they eat a type of plant and a type of mineral in the plant turns the flamigo pink it should be the same with ants
L-I,i agree with varsha becasue i onlny see moss on tree bark and the ground dirt
L-I,i agree with you because trees and plants can not live with out chlorophyll
L-I,i also think that the moss grows to the north because the north is colder and moss usually grows in cool and wet conditions
L-I,i also think that the moss is effected by the tree position
L-I,i can add on to that beacuse when the weather is putting the pressure on to the apple and making it fall off the tree its like when someone were to push you off the edge of a pool the pressure of the person pushing you is putting impact on your boby and therefore making you fall into the pool also i agree with you saying that if a person were sick its like an apple slowly rotting because it dosn't have the nutrients to grow off of
L-I,i can add on to that because when weather puts the pressure on the matter it can make it transfer into a different shape or fall apart like if there was a tsunami the waves are so strong that they can make houses and buildings fall apart and it can squish cars and make them flat or put them into a different shape or like when you pour water into a cup it takes the form of the cup
L-I,i dissigry they carry sand one by one i think
L-I,i don't think plants have energy i think they have nurtrients that turns in to fuel energy for the thing thats eats them
L-I,i don't think the moss will die out because when moss dies it will become rich soil for new mosses and plants to grow
L-I,i dont think metal ever lived
L-I,i dont think so because what if a bee died in it
L-I,i learned tha there are over 12 000 types of ants also they are soical insects witch mean they move in larage groups
L-I,i noticed that maybe only some trees have moss growing to the north maybe like a compass moss will grow to the north because there is something there what is that something
L-I,i predict that the moss on the ground will keep growing if it gets water and sun or else it will die my theory is that the cold weather and the rain will keep it alive or the rain will sit there and the cold will freeze it
L-I,i think once the ivy interacts with the skin it will infect the outside layer of skin and the interaction will cause an infection from bolth the ivy and the skin and that will create the rash
L-I,i think that the weather is making the apples fall down beacause the wind is putting preser on the apple my theory is that when the apples fall down they rot because they don't get the nuterents they need i need to understand that the applesare like people if the don't get there nutrents they get sick
L-I,i think that there is nutrients in thing animals eat that give them energy if they can't get energy they might be a canirvor if it's a plant because they can't convert those nutrients
L-I,i think you miss understand what spores are spores are kind of like the seeds for moss exept there´re microscphic
L-I,i think your 2 answer is correct and that it is probably a different type of moss
L-I,if a feamle ants eat the right food they turn into queen ants
L-I,if an ant eats the right kind of food it can become a queen ant
L-I,in photosynethesis the plant will use energy from the sunlight to convert carbon dioxide from the atmosphere into simple sugars a plant needs water and sunlight for food
L-I,in the daytime the hot air comes from the river and than it goes up in the air and than the cold air replaces it in the courtyard when its about to be winter the nights are cold but in the summer the nights are worm by the ways the air cycle in the daytie is the opposite of the air cycle in the nightime
L-I,is that the green side might be for camofloging with the leef and brown side for sand
L-I,it interacts with humans because if it is contagous than it can spred around if you tuch it
L-I,it probably grew like that over time maybe something happened to it
L-I,leaves absorbe the sun light and water and creates the suger that it uses to live
L-I,maybe a cherry tree or some type of trees full of fruits
L-I,maybe small animals like ants for a nest or a birdwhen the moss is on the tree the bird might use it for it's nest
L-I,maybe the ant that eats the right food will not be the king because it dosen't lay babies but it can lead the other ants to find another group with a queen
L-I,maybe there is somethingattracting the moss so it goes north
L-I,mosquioes are the most different creature on the planet because its one of the only living creature carry diseases
L-I,moss only grows on the northern side of tress if the tree lives in the northern hemisphere if the tree lives in the southern hemisphere the moss grows on the southern side of trees
L-I,moss will grow better in damper places because it takes in all the water in the air
L-I,most animals need water to survive water allows metabolism occur which is the process that drives all the biochemical reaction that take places in cells
L-I,most likely it would not grow just because that the roots are whatstartthe process for the tree to grow my theory mostly is that the tree will not grow anymore but will still live unless you cut it or it falls
L-I,my theory is you can feel the sun on you even if itś far away because the rays give off a whole lot of energy the sun reflects on a cloud and a cloud shoots to the ground like a mirror
L-I,my theroy is that white soil interacts with the plants the same as brown regular does because i have observed no change between either white soil or regular brown soil my hypothisis is that they are just diffrent colors and i do not think that that change makes a diffrence of how they grow
L-I,no because metal is not madde out of anything living
L-I,noah another term is apex prdetor wich means top of the food web
L-I,out side in the courtyard i found a brick wih a small patch of moss in the middle of the brick touching no other patches of moss i need to understand how the moss lives this theory cannot explain because i have not gatherd enough informaition
L-I,photosynthesis is the process by which green plants and some other organisms use sunlight to create foods from carbon dioxide and water
L-I,photosynthesis is the process used by plants algae and certain bacteria to harness energy from sunlight and turn it into chemical energy here we describe the general principles of photosynthesis and highlight how scientists are studying this natural process to help develop clean fuels and sources of renewable energy
L-I,poison in poison ivy poison oak and poison sumac is called urushiol and it is used to protect the plant never burn the plant because if the urushiol gets in the air and you breathe it in it will most likely kill you
L-I,rhizoids are the super thin roots that hold the moss in place they aren´t very strong so you could pick it up without struggle
L-I,serena an egg is clear then it turns white when it is older then the baby is clear and gets its colors when it's oldercamryn a baby is clear till it gets older than they turn a dark brown
L-I,some caterpillars like monarchs eat milkweed leaves so that they can scare there predators off and so they dont get eaten
L-I,some flowers are very sweetsmelling and they originally grew thorns to protect themselves from animals that may try to eat them so my theory is that they they may have been for protection like you said
L-I,spiders eat insects and get eaten by birds and fish so spiders are first level predators but not apex predators
L-I,spores are carried by the wind then it grows into moss
L-I,"the apple rots because the enrgery from the tree put it into the apple when it was on the tree and when said apple fell off of the tree it didn't get any more ""food"" from the tree so it will rot and die then posibly get eaten"
L-I,the bettle has a brown side for camiflouge and the green side is for that if camiflouge fails it can turn around to show the brigh green side to try to scare away the preadator
L-I,the energy is still being produced because if it stoped the tree would die the leaves are probably are getting weak and dry because the cold
L-I,the female moquitos spit on your skin to num up your skin were it smells looks sweeet and suger filled and then they put their sharp nose in your skin and find a blood vesel and suck out your blood
L-I,the freezing and cold tempretures will kill the moss and the rain will help it grow
L-I,the plant also useswater from rain and carbon for the process to work for the gluocose like a cooking recipe
L-I,there are diffrent types of moss such asiron moss wich will only grow on thigs with heavy amounts of iron on it my theory is that the moss only sticks to certain things your friend sienna
L-I,there can be a lot of different animals new information insects are anials too if insect are animals there is so many types of animals like grass hoppers ants mousqutioand other different insects
L-I,they give plants energy and animals eat that plant so they get energy and so on
L-I,they need sugar so they could make fruits and my question is how do the plants make sugarphoto=light and synthesis=putting toghetherleaves have tiny pores called stomata so carbon dioxide can enter the plant
L-I,toads can burrow if there is a predotor or a emergency maybe thats where toads go when its winter under ground
L-I,when do the mosquitos stop drinkings the blood well that's a good question etheir the mosquito's stomach gets full or it gets spotted and flys away quickly or dies because it got swatted by somebody
L-I,when the apple falls from the tree it gets a bruise then the decomposers build o to the bruise and takes the energy from the apple then the apple rots
L-I,when the apples fall they interact with the air because the apple is falling through the air when it falls to the ground it is interacting with leaves over time the apple will interact with decomposers the decomposers interact with the apple by eating it so it get rotten
L-I,when they dig the ants push dirt out to make tunnles witch makes a ant hill like when you dig with a tunnle
L-I,when they fall of the tree than they cant grow any more like a human when a human eats and than grows and you grow till you cant grow any more than advetually die so thats the same with apples
L-I,why are baby ants white when their born and then they turn to their regular ant colony color and not just be born the same color as their ant colony what i did learn though is that when the ants are born they have no legs and can't do anything without the help of the other ant or so called worker ants my theory is if the baby ants are born without legs and can't do anything by itself maybe that has to do with why its color is white also if their decomposers maybe something from that equals to why the baby abts are born white and if they eat te right type of foods they can turn to their regular coloies colors
L-I,yes my theory is yes during oter sesings in winter ther fur might white or oter colers
L-I,"image kf6 rit albany edu manual_assets kf4images iconnoteunreadothr gif"" missing link "" link contribution by missing authors when a tardigrade is dry up it starts to synthesize special molecules which fill the tardigrades cells to replace lost water by forming a matrix a matrix is like a net the marix keeps cells from the tardigrade from moving or combining"
L-I,a better theory i think ant hills are living because the are in are ecosystem and they are ecsposed to air to live
L-I,my theory a daddy long legs fangs are to short to bite people but there tails are have been so deadly with venom
L-I,my theory is that maybe the berries are a source of food to the stink bugs and that's why they were all over the berries
L-I,my theory is that moss lets go clusters of seeds into the air and let the wind carry it away
L-I,my theory is that spiders can climb up walls because they shoot a spider web up and climb it and the web is sticky
L-I,my theory is that the enviormet is good here at this time
L-I,my theory is that the ground hog that we saw might live here in guilderland because there are nutrients maybe here so that is why i am searching wy groundhogs live in guilderland this theory cannot explain why ground hogs live in guilderland
L-I,my theory is that the moss might have got stuck on the brick somehow and there might have some water on it that might keep it sticking if you look in google how it gets stuck on the brick and gets nutrients from it might help
L-I,my theory is that there are all kinds of diffrent cattipilers but there is only one kind that i know that is piosenes and it is white with black spikes and it is really cool iv seen one or two before and thoes are the most dangoures cattipilers that i know
L-I,my theory is that there is oil on the poison ivy that makes you ich and there is alot of diffrent ways it can get in any were at any time at any place
L-I,my theory is that they are poisonis because they eat stuff that makes them poison is
L-I,my theory is that they eat anamals that cant hert them that much
L-I,my theory is that they go down deep so preditors will not eat them
L-I,my theory is that they need food to survive
L-I,my theory is that they need there fur to survive and water food
L-I,my theory is that they still could live because they would still have a lot of their legs and most likely 2 legs would not through them of ballance
L-I,my theory is that weather is a super strong force that uses lots of different matter like wind water houses and more weather can c hh znge a lot of things like people if it always snowed no crops could grow and all living things would die out
L-I,my theory is the apple fell of the tree and the decomposers eat the apple and the apple got less energy and rotted
L-I,my theory is the spider might still live for ages because a spider needs equal legs
L-I,my theory is the thorns are usedto keep plant eating animals away we should work together on this wondering
L-I,my theory is there might have been nutrients on the bery so that must be why
L-I,my theory is they might crall over the school like going on it and crall on to the roof to go in the courtyard
L-I,my theory is apples fall because of gravity the apple falls when it gets ripe once it is ripe it gets weak around the stem and the gravity pulls it down to the ground
L-I,my theory is toads do not go undergrond because they do not go undergrondthey go into a state of hibernation and somecanbe exposed to temperatures below freezing aquatic
L-I,my theory is that the white and black catipiller is piosonous but some one else thinks there is another black and white catipiller in florida but i disagree
L-I,my theory it is probably damp there to because it is dark and that stops the sun from drying it so maybe it grows in dark and damp places
L-I,my theory mosquitos are the most deady creatures in the world they can cary thousands of deiseases
L-I,my theory moss grows on the north side of trees because water evaporates on the north side of the tree in the southern hemisphere water evaporates on the south side of trees
L-I,my theory my theory is that ants find the hills and just put hole and the top the dont build the hills
L-I,my theory of why the stinkbugs are not moving when they are on the berries is maybe they want it as their source of food and the stinkbugs don't want the other stinkbugs getting over the berries also maybe since it's getting colder the stinkbugs want to get as much food as they can because it will be a lot colder and the stinkbugs will lose their sources of food
L-I,my theory poison is used to scare predetors away or else the predotor will dye slowly
L-I,my theory seeds are living matter because seeds in apples are like unborn children they dont grow but when they get the right treatment they grow into a huge apple tree
L-I,my theory that plants don't have energy in them they have nutrients and ogranisoms that eat them that eat plants get the nutrients into energy to move and do other stuff animals that don't don't get the energy
L-I,my theory mosquitos are the most deadly animals in the world they cary thousands of diseases
L-I,my theory moss does not only grow on the north side of trees moss grows on the north side of trees if the tree lives in the northern hemisphere the reason for this because the sun hits the north side of trees so water evaporates so moss grows if the tree lives in the southern hemisphere it grows on the south side
L-I,my theory wonce one gets in it lays eggs whitch makes more and one probibly crawled on the roo
L-I,my theory grasshoppers go through 4 stages of their life cycle egg nymph adult grasshoppers and death a nymph looks like a little adut grasshopper but with out wings
L-I,my theory i think the worms use the slime on their bodies help them to move around in the soil
L-I,my theory is that it's wind
L-I,my theory is that the plant starts to dies when the soil becomes more unheathly or they can't get the minerals that they need
L-I,new information moss seedless spores the wind carriess the spores throw the air and if it is in the right codistion then it will land on ground and it will grow the plant called moss
L-I,anthony female mosquitos are the only mosquitos that drink blood because they need nutrients for their eggs male mosquitos are harmless and instead eat nectar
L-I,i agree with owian but i think that the ants do a few grains of sand dirt at a time
L-I,i agree with serena because the plants made no progress over the weekend so i will also check with serena if the plants made any progress on the 7th of december and\or 10th of december
L-I,i noticed that ants were crawling around sand and there was a ant hole i need to understand how living underground impacts ants and what impacts ants living underground my theory is that snow and rain impacts ants living underground by bringing the ant hole down also does warm weather impact ants living underground also
L-I,i noticed that moss does not have seeds i need to understand that why does moss grow if it does not have seeds so it can grow my theory is moss is growing because a reaction that supposedly it makes moss grow
L-I,i noticed that moss was growing on the trees i need to understand why does moss grow on the tree my theory maybe the weather effects the moss or the light
